"id","question_name","category","status"
"","అధికంగా శ్రమించే శ్రామిక జీవుల చేతులు, అరి కాళ్ళ చర్మం మందంగాను, ఉండటానికి కారణం","1","1"
"","తోలు' అనేది ఈ క్రింది ఉత్పన్నము","1","1"
"","ఎనామిల్' అనేది ఈ క్రింది వానిని కప్పి ఉంటుంది","1","1"
"","ఆకులు ఆహారంగా తీసుకునే గొర్రె లాంటి జంతువులలోని ఆహార పదార్థాలలోని సెల్యులోజ్ జీర్ణక్రియ ఫలితంగా అంత్యపదార్థాలుగా జీర్ణవాహికలో మిగిలిపోతాయి","1","1"
"","సగం ఉడికిన ఆలుగడ్డలను ఆహారంగా తీసుకున్న, అవి జీర్ణం కాలేదు. దీనికి కారణం","1","1"
"","పరిపక్వ చెందని కొన్ని చెట్లలో కాయలు చెట్ల నుండి రాలిపోతాయి. దీన్ని నివారించుటకు","1","1"
"","హృదయం గరుకు అనేది ఈ క్రింది విధంగా వస్తుంది","1","1"
"","మెదడులో రక్తం ఎన్ని సెకన్ల కాలం ప్రవహించలేకపోతే స్పృహను కోల్పోతారు","1","1"
"","బోల్దింగ్ మరియు రోశెట్టి విధానం వంటి ప్రక్రియలో పాలుపంచుకునే వృక్ష హార్మోన్లు","1","1"
"","ఈ క్రింద పేర్కొనబడిన 'కణాంగము' ను ఆత్మాహుతి కోషంగా వ్యవహరించుచున్నాము. ఎందుకనగా వివిధ రకాల కణ నిర్మాణాలను జీర్ణక్రియ చేయటంలోనూ, మొత్తం కణంను జీర్ణం చేయుటలోనూ తోడ్పడుతుంది. ఈ కణాంగాలు ఏవి","1","1"
"","ఇటీవలే మెడికల్ సైన్సులో ఆవర్తక పదార్థ ధర్మముతో, రేడియేషన్ ధర్మాలను ఉపయోగించకుండా, కేవలం లిప్తకాలంలో బయోకెమికల్ సమాచారం ఇవ్వగలిగితే ఈ రసాయన విశ్లేషణాకారి","1","1"
"","ముష్కాలు సాధారణంగా ముష్కగోణులలో దిగబడే కాలం","1","1"
"","మెనోపాజ్ చేరుకునే వయసు","1","1"
"","సాధారణ స్థితిలో ఋతుచక్రం ప్రారంభమయిన రోజు నుండి అండోత్పాదక నాళికలు పరిపక్వతను ఈ రోజులలో సాధించుతుంది","1","1"
"","యుక్త వయస్సు గల మనిషి యొక్క అస్థిపంజరంలో ఎముకల సంఖ్య","1","1"
"","చెవి ఎముకల మొత్తం సంఖ్య ఎంత?","1","1"
"","క్రింది చేపలో మిగతా మూడు చేపల కంటే ఏది పుచ్చాల విభేదన చూపుతుంది","1","1"
"","చాలా రకాల చేపలు నీటిలో మునగవు, కారణం ఈ క్రింది నిర్మాణాలు కల్గి ఉండటం వలన","1","1"
"","ఈ క్రింద పేర్కొన్న జంతువులలో దేహనిర్మాణములో ఫ్లిప్పర్స్ లు వుంటాయి","1","1"
"","బ్రతికి వున్న పక్షులలో అతిపెద్దది","1","1"
"","ఈ క్రింది క్షీరదము గుడ్లను పెట్టగలదు","1","1"
"","సూడోసీల్ ఈ క్రింది వానిలో వుంటుంది","1","1"
"","బ్యాక్టీరియా ఫేజ్' అనేవి","1","1"
"","మొదటిసారిగా వైరస్ లను రసాయనికంగా స్పటికాల రూపంలో వేరు చేసినందుకు నోబెల్ బహుమతి వచ్చింది. ఆ శాస్త్రవేత్త పేరేమిటి?","1","1"
"","ఈ రోజు శాస్త్ర ప్రగతి అంతయు అణుజన్యుశాస్త్ర పరిశోధనలపై ఆధారపడింది. ఈ పరిశోధనలకు E.Coli అను బ్యాక్టీరియాలను మాధ్యమంగా తీసుకుందురు. వీటిని సంవర్దనయానకం కోసం ఈ క్రింది నమూనాలను సేకరించవచ్చును","1","1"
"","ఒక జన్యువు - ఒక ఎంజైమ్ సిద్ధాంతం' ప్రకారం ఒక జన్యు అనువంశిక లక్షణాలను క్రమబద్దీకరణ చేస్తూ, కేవలం ఒక ఎంజైమ్ సంశ్లేషణలో పాల్గొంటుంది. ఈ విధానమును ప్రయోగపూర్వకంగా నిరూపించినవారు","1","1"
"","గ్రెగర్ మెండల్' ను జన్యుశాస్త్రపితామహుడు' గా జీవశాస్త్ర పరిశోధనకు వర్ణించుతారు. మొదటిసారిగా గ్రెగర్ మెండల్  జన్యు సూత్రాలను ప్రతిపాదించాడు. ఇతను ఏ జంతువులలో/మొక్కలలో ప్రయోగాలను జరిపినారు","1","1"
"","జన్యువుఅనేది అనువంశిక ప్రామాణిక నిర్మాణము. ఈ నిర్మాణమును రసాయనికంగా మొదటగా తయారు చేసినవారు","1","1"
"","మానవునిలో క్రోమోజోముల జత లింగ- నిర్దాయికంగా ఉంది. ఈ క్రోమోజోమును, సెక్సు క్రోమోజోములు అందురు. మిగిలిన క్రోమోజోములను ఈ క్రింది విధముగా వర్ణించవచ్చు","1","1"
"","ఈ క్రింద పేర్కొన్న మానవుని వ్యాధులలో వంశపారంపర్యంగా సంక్రమించేది","1","1"
"","ఒక తెల్లని వర్ణం గల స్త్రీ, నల్లని వర్ణం గల పురుషులను వివాహమాడినారు. వీరికి జన్మించిన నలుగురు పిల్లలలో - ఇద్దరు పురుషులు, ఇద్దరు స్త్రీలు. ఇద్దరు పిలల్లు నలుపు రంగు కావటానికి కావలసిన అనుపాతం శాతం","1","1"
"","కొన్ని రకాల మానవుని వ్యాధులు జన్యు నియంత్రణలో ఉంటాయని నిర్ధారణకు వచ్చిన శాస్త్రవేత్త","1","1"
"","ఈ క్రింది ఏ రకమైన మానవుని వ్యాధులు అనువంశికతతో క్రమబద్దీకరించవచ్చు","1","1"
"","ఒకవేళ ఒక పాత చెట్టును పార్శ్వంగా కోసినట్లైతే, వివిధ రకాల వృద్ధి వలయాలు కనిపిస్తాయి. ఈ వృద్ధివలయాలను సంఖ్యను బట్టి ఆ చెట్టు యొక్క వయసును తెలియజేయవచ్చు. ఈ వలయాలను ప్రధానముగా ఈ క్రింది మొక్కలలో చూడవచ్చును","1","1"
"","ఇది ఆర్కిటిక్ మరియు అల్పైన్ ప్రాంతంలో మంచుగడ్డలు ఎరుపు రంగులో కనిపిస్తాయి. ఈ 'ఎరుపు మంచు' దృగ్విషయాలు ఈ క్రింది కారణాల వలన కలుగుతాయి","1","1"
"","ఎరుపు రంగు అలల కారణంగా పశ్చిమ తీరాలలోని ఫ్లోరిడాలో మిలియన్ల కొద్ది చేపలు చనిపోతున్నాయి. ఈ ఎరుపు అలలకు కారణం ఏమనగా","1","1"
"","నోరి' అనునది జపానీస్ యొక్క ఇష్టమైన ఆహార పదార్థములు. దీన్ని ఈ క్రింది వాని నుండి తయారుచేయవచ్చు","1","1"
"","త్రాగే టీ ఎరుపు త్రుప్పు రంగు ఉండడానికి కారణం","1","1"
"","లైకెన్స్' అనునది, స్వయం పోషక లక్షణంగా గలిగే 'ఆల్గే' మరియు, ఈ క్రింది వాని సన్నిహిత సంబంధము కలదు","1","1"
"","కొన్ని వృక్షపు జాతులలో పండ్ల వృద్ధి ఫలదీకరణం ప్రక్రియ లేకుండానే జరుగుతుంది. ఈ దృగ్విశయమును ఈ క్రింది విధంగా వర్ణించవచ్చును","1","1"
"","లిట్మస్' అనునది ఈ క్రింది వాని నుండి లభ్యమవుతుంది","1","1"
"","కొన్ని రకాల పుష్పించే మొక్కలు ఎలర్జీని ఉత్పత్తి చేసే పుప్పొడి రేణువులు కలిగి ఉంటాయి. ఈ మొక్కలు సర్వసాధారణముగా","1","1"
"","ఈ క్రింది వృక్ష జాతి వేరు వ్యవస్థ నుండి వీటిని సంగ్రహిస్తారు","1","1"
"","ఈ క్రింది జాతిమొక్కలకు పుష్పించే మొగ్గల నుండి వీటిని తయారుచేయవచ్చును","1","1"
"","సూక్ష్మజీవనాశిని ' Ampicillin' అనేది ఒక","1","1"
"","మొట్టమొదటిసారిగా ఈ క్రింది శిలీంద్రనాశినిని వృక్షవ్యాధుల చికిత్సకై కనుగొన్నారు","1","1"
"","యాపిల్ పంటలో నీటి సమతుల్య వ్యాధి కారణమైనది","1","1"
"","ఈ క్రింద పేర్కొన్న వృక్ష వ్యాధులలో వైరస్ వల్ల సంక్రమించే వ్యాధుల పేర్లను తెలపండి","1","1"
"","చెరకు, వరి వంగడాలపై ఆశించే విచ్ లీడ్ వ్యాధికి కారణం అయినది ఏది?","1","1"
"","క్రింద పేర్కొన్న  వృక్ష వ్యాధులలో, ఏది బ్యాక్టీరియన్ సంక్రమణకి సంబంధించింది కాదు?","1","1"
"","నిమోటోడాల అదుపునకై ఈ క్రింది పద్దతులు ప్రభావికంగా ఉంటాయి","1","1"
"","ఈ క్రింది వ్యాధిజనకాలు 'ఈగ' ల ద్వారా వ్యాప్తించవు","1","1"
"","అంటు వ్యాధి కాకుండా, మిగతా వ్యాధులకు కూడా 'ఎనాఫిలస్ దోమలు' వాహకంగా పనిచేస్తాయి","1","1"
"","ఈ క్రింద పేర్కొన్న వ్యాధుల గ్రూపులు సాధారణంగా సకశేరుకాల నుండి మానవునికి ట్రాన్స్ మిట్ అవుతాయి","1","1"
"","మొట్టమొదటిసారిగా ప్రభావవంతమైన పోలియో వాక్సిన్ ను తయారుచేసినది ఎవరు?","1","1"
"","ఈ క్రింద పేర్కొన్న వ్యాధుల గ్రూపులు దోమకాటు వలన మానవులకు వ్యాపించుచున్నాయి","1","1"
"","రూబెల్లా కి మరొక పేరు","1","1"
"","మలేరియా' వ్యాధి నివారణకు మందు ఈ మొక్క నుండి తీస్తారు","1","1"
"","అతిగా ఆల్కహాలు తీసుకునే వారు సాధారణంగా ఈ క్రింది వ్యాధులతో మరణిస్తారు","1","1"
"","సాధారణ క్రమానుగ్రత శ్రేణిలో గడ్డి మొక్కలను ఆవులు తినడం, ఆవును మనుషులు తినడం లేదా ఆవుపాలు త్రాగడం అనేది ఈ క్రిందివానికి ఉదాహరణ","1","1"
"","ప్రపంచంలో ఎక్కువ జనాభా గల ప్రాంతాలలో ఆహారపు కొరత ఉంటుంది. అక్కడ ఈ క్రింది వాటిలో వినియోగం ఉంటుంది","1","1"
"","జనుము ఉత్పత్తి చేసే దేశాల్లో వాటి వినియోగం ఈ క్రింది క్రమంలో ఉంటుంది","1","1"
"","ఈ క్రింద వ్యవహరించబడిన వృక్ష/జంతు సముదాయములలో అత్యదిక ఉష్ణోగ్రతల దగ్గర పెరుగుతూ, తదనుగుణంగా వృద్ధి కనబరుచుతాయి","1","1"
"","స్మోగ్' వాతావరణ పరిస్థితితో, ఏ క్రింది కారకాలు ముఖ్యంగా కంటికి ప్రమాదకారిగా దోహదం చేస్తుంది","1","1"
"","కోల్ బర్నింగ్ పవర్ ప్లాంట్స్ మరియు ఫ్యాక్టరీలు 86% వరకు ఈ క్రింద పేర్కొన్న వాయువు ఆమ్లాలను వాతావరణంలోకి వదిలివేయబడుతాయి","1","1"
"","ప్రతి ఒక జీవరాశులలో 'కణం' అనే ప్రాథమిక అంశాలలో నిర్మింపబడి వుందని, ప్రతి కణం ప్రాథమికంగా నిర్మాణాత్మక, క్రియాత్మక ప్రమాణమని తన సిద్ధాంతములలో ఒక ముఖ్యాంశాములుగా పేర్కొనినవారు
1. లూయిస్ పాశ్చర్
2. ఎం.జె. షైడ్లన్
3. రాబర్ట్ హుక్
4. స్క్వాన్","1","1"
"","ఒక కేంద్రపూర్వ కానమును వికేంద్రకణమును ఈ క్రింది విధంగా విభేదించవచ్చును
1. ఒకే ఒక కణంను కలిగి ఉంటుంది
2. కణాంగాలైన మైటోకాండ్రియా మరియు గాల్జి కేంద్రకాలను కలిగి యుండుట
3. త్వచయిత కేంద్రకాలను లేకపోవుటను
4. రైబోజోమ్ లు లేకపోవుటను","1","1"
"","ఈ క్రింది వానిలో 'ప్రోక్యారియోటిక్ కేంద్రక పూర్వకణము' కానిది ఏది?
1. కొరెల్లా
2. ఇన్ ఫ్లూయెంజా
3. ట్యూబర్ క్యులోసిస్ బ్యాక్టీరియా
4. ఈస్ట్","1","1"
"","ఒక జంతుకణం, ప్రాథమికంగా ఒక వృక్షకణం నుండి ఈ క్రింది విధంగా విఛేదనం చూపుతుంది","1","1"
"","వివిధ రకాల జీవన రసాయన చర్యల్లో ఎంజైములలో అతి ముఖ్యమైన నిర్మాణాంశాలైన కో ఎంజైమ్స్ చర్య ప్రక్రియలో తోడ్పడుతుంది. ఈ కో ఎంజైమ్ ముఖ్యంగా ఈ క్రింది జీవే పదార్థాల నుండి ఉత్పన్నం అవుతాయి
1. రైబో ఫ్లోవిన్
2. నికోటినమైడ్
3. ఆస్కార్బిక్ ఆమ్లం
4. గ్లూటమేట్","1","1"
"","ఫలదీకరణ సమయంలో శుక్రకణం అండంలోకి చొచ్చుకు పోవు సమయంలో ఈ క్రింద పేర్కొన్న ఎంజైములు తోడ్పడతాయి
1. ట్రిప్పీన్ లాంటి ఎంజైములు
2. హైయలో రోనిడేస్
3. స్పెర్మెజ్
4. స్పెర్మిన్","1","1"
"","ఈ క్రింది ఇవ్వబడిన వ్యాధుల సమూహాలలో లోపరహితం కారణంగా వచ్చేవి 
1. సాధారణ గాయిటర్ మరియు ఓరియంటల్ సోర్
2. గ్జెరా ఫ్తాల్మియా మరియు వర్ణంధత్వం
3. రేచీకటి మరియు మరాస్మస్
4. బెరిబెరి మరియు ఆస్ట్రియోమలేషియే","1","1"
"","క్షీరదాల హృదయవరణంలో రక్త ప్రసరణ దశలు ఈ క్రింది విధంగా తెలపబడ్డాయి
1. ఎడమ కర్ణిక
2. ఎడమ జటరిక
3. కుడి కర్ణిక
4.'కుడి జటరిక","1","1"
"","పశువుల పై దవడలలో శాశ్వత రధనికల సంఖ్య","1","1"
"","ఒక కోడిగుడ్డులో కార్బోహైడ్రేట్ ల భారం","1","1"
"","ప్రపంచ ప్రసిద్ధిగాంచిన అధిక గుడ్లు పెట్టే కోళ్ళ జాతి ఏది?","1","1"
"","భారతదేశంలో పొడవైన గొర్రెజాతి","1","1"
"","ఈ క్రింది జంతువులలో నెమరు వేయనిది ఏది?","1","1"
"","""గల్లస్, గాలస్"" క్రింద ఇవ్వబడిన వయస్సులో లైంగిక పరిపక్వతను చూపుతుంది","1","1"
"","పశు సంపదలో ఈ క్రింది వ్యాధి కారకంగా వంజత్వం వస్తుంది","1","1"
"","ఈ క్రింది వ్యాధులలో వైరస్ వల్ల రానిది ఏది?","1","1"
"","దేశ వ్యాప్తంగా ఈ క్రింది రాష్ట్రంలో అత్యధిక సంఖ్యలో పందులు కలవు","1","1"
"","బైకాన్, హామ్ మరియు లార్డ్, ఈ పదాలు కింద ఇవ్వబడిన పశు సంపదకు సంబంధించింది ","1","1"
"","రాజస్థాన్ లోని ఏ జాతి గొర్రెల నుండి మన్నిక గల ఉన్నిని తీస్తారు","1","1"
"","ఆవు, బర్రెల లాంటి జీవాలలో పై, కింది దవడలలో శాశ్వత రధనికల సంఖ్య","1","1"
"","యూరప్ లాంటి దేశాలకు ఎగుమతి అయ్యే అతిమన్నిక గల కార్పెట్ లను తయారు చేయగలిగే, జోరియా ఊలును ఈ క్రింది గొర్రె జాతి నుండి తీస్తారు","1","1"
"","ఒంటెలో గర్భావది కాలం","1","1"
"","భారతదేశ ఆర్థిక వ్యవస్థలో మేక సంతతి ఆర్థిక వనరుల వాటా","1","1"
"","నాన్నీ అనేది ఏ జాతికి చెందిన ఆడ జంతువు","1","1"
"","మేక జాతిలో పాశ్ మేనియా అనేది క్రింది జాతి నుంచి ఉద్భవించింది","1","1"
"","ఈ క్రింది వ్యాధులలో బాక్టీరియా వ్యాధులకు సంబంధించినవి
1. ఏవియన్ డిఫ్తీరియా
2. మ్యాస్టిటీస్
3. బ్లాక్ క్వాటర్
4. ఫూట్రాట్","1","1"
"","మెదడు పనితనాన్ని తెలియజేసే యంత్రం ఎలక్ట్రో ఎన్ సెఫెలో గ్రామ వాని సాంకేతిక వివరణలు ఈ క్రింది వ్యాధి నిర్ధారణలో ఉపయోగపడుతుంది
1. ఎపిలెప్సి
2. మెదడుకు ఇన్ఫెక్షన్స్, మెదడుపై మందుల ప్రభావం
3. నిద్ర మరియు వాటి యొక్క అసాధారణ రూపాలు
4. బ్రెయిన్ డెత్","1","1"
"","ఈ క్రింది వ్యాధుల పేరులో వ్యాధి జనక ప్రోటోజోవాల వలన వచ్చే వ్యాధులను గుర్తించండి
1. కోకైడయోసీస్
2. బేబీషియోసీస్
3. స్పోరింగ్ వ్యాధి
4. జానీస్ వ్యాధి'","1","1"
"","వృక్ష కణ దేహాలలోని విభాజ్యా కణజాలం ప్రాథమికంగా ఈ విధులను నిర్వర్తిస్తుంది","1","1"
"","వాణిజ్యపరంగా కార్క్ అనేది ఈ క్రింది వృక్షం నుంచి తీసే బెరడు","1","1"
"","ఏపిడర్మిస్ అనేది పత్రం యొక్క పైన ఉన్న త్వచపు కణజాలం దీనిలో వాయు వ్యాపనాన్ని నిర్వర్తించే రంధ్రాలను ఈ విధంగా పిలుస్తారు","1","1"
"","స్త్రీ మరియు పురుష పుష్పాలు కలిగి ఉన్నటువంటి వృక్షాన్ని ఏమంటారు?","1","1"
"","సబ్-జీరో ఉష్ణోగ్రతల వద్ద బ్యాక్టీరియా ఈ కాలం వరకు జీవించగలదు","1","1"
"","ఒక గ్రాము ఫలవంతమైన నేలలో బ్యాక్టీరియాలు సుమారుగా","1","1"
"","మొదటిసారిగా ప్యూర్ కల్చర్ లో బ్యాక్టీరియాను వృద్ధిపరిచిన శాస్త్రవేత్త","1","1"
"","బ్యాక్టీరియాల వల్ల వృక్షానికి కలిగే వ్యాధి","1","1"
"","ఆమీస్ పరీక్ష ఈ పరీక్షను తెలుపుతుంది","1","1"
"","అనువంశికత లక్షణాలను క్రమబద్దీకరణం చేసే కారకాన్ని జీన్ అనే మాటను ప్రవేశపెట్టిన వారు","1","1"
